<?xml version="1.0" encoding="UTF-8"?>
<!--
/**
 *  Title: Entity Generator Definitions for the General Data Model
 *  Description: None
 *  Copyright (c) 2001-2005 The Open For Business Project - www.ofbiz.org
 *
 *  Permission is hereby granted, free of charge, to any person obtaining a
 *  copy of this software and associated documentation files (the "Software"),
 *  to deal in the Software without restriction, including without limitation
 *  the rights to use, copy, modify, merge, publish, distribute, sublicense,
 *  and/or sell copies of the Software, and to permit persons to whom the
 *  Software is furnished to do so, subject to the following conditions:
 *
 *  The above copyright notice and this permission notice shall be included
 *  in all copies or substantial portions of the Software.
 *
 *  THE SOFTWARE IS PROVIDED "AS IS", WITHOUT WARRANTY OF ANY KIND, EXPRESS
 *  OR IMPLIED, INCLUDING BUT NOT LIMITED TO THE WARRANTIES OF
 *  MERCHANTABILITY, FITNESS FOR A PARTICULAR PURPOSE AND NONINFRINGEMENT.
 *  IN NO EVENT SHALL THE AUTHORS OR COPYRIGHT HOLDERS BE LIABLE FOR ANY
 *  CLAIM, DAMAGES OR OTHER LIABILITY, WHETHER IN AN ACTION OF CONTRACT, TORT
 *  OR OTHERWISE, ARISING FROM, OUT OF OR IN CONNECTION WITH THE SOFTWARE OR
 *  THE USE OR OTHER DEALINGS IN THE SOFTWARE.
 *
 * @author     David E. Jones (jonesde@ofbiz.org)
 * @author     Andy Zeneski (jaz@ofbiz.org)
 * @version    $Rev$
 */
-->

<entitymodel xmlns:xsi="http://www.w3.org/2001/XMLSchema-instance" 
    xsi:noNamespaceSchemaLocation="http://www.ofbiz.org/dtds/entitymodel.xsd">
  <!-- ========================================================= -->
  <!-- ======================== Defaults ======================= -->
  <!-- ========================================================= -->
    <title>Entity of an Open For Business Project Component</title>
    <description>None</description>
    <copyright>Copyright (c) 2002 The Open For Business Project - www.ofbiz.org</copyright>
    <author>None</author>
    <version>1.0</version>

  <!-- ========================================================= -->
  <!-- ======================== Data Model ===================== -->
  <!-- The modules in this file are as follows:                  -->
  <!--  - org.ofbiz.catalina.session -->
  <!-- ========================================================= -->


  <!-- ========================================================= -->
  <!-- org.ofbiz.catalina.session -->
  <!-- ========================================================= -->

    <entity entity-name="CatalinaSession"
            package-name="org.ofbiz.catalina.session"
            title="Catalina Session Store">
      <field name="sessionId" type="id-long-ne"></field>
      <field name="sessionSize" type="numeric"></field>
      <field name="sessionInfo" type="blob"></field>
      <field name="isValid" type="indicator"></field>
      <field name="maxIdle" type="numeric"></field>
      <field name="lastAccessed" type="numeric"></field>
      <prim-key field="sessionId"/>
    </entity>
</entitymodel>